id,title,score,num_comments,author,created_utc,url,over_18,edited,spoiler,stickied
1hzrw4w,My vps internet speed is very slow,11,27,me_localhost,2025-01-12 17:32:01,https://www.reddit.com/gallery/1hzrw4w,False,False,False,False
1hzmbee,Joining AWS in Seattle,4,15,Far-Range8244,2025-01-12 13:09:32,https://www.reddit.com/r/aws/comments/1hzmbee/joining_aws_in_seattle/,False,False,False,False
1hzkxff,Why is it that my REST API is intermittently returning 502?,6,13,urqlite,2025-01-12 11:40:05,https://www.reddit.com/r/aws/comments/1hzkxff/why_is_it_that_my_rest_api_is_intermittently/,False,False,False,False
1hzyyvm,Could AWS be the solution for our company?,3,16,Dizzy-Gap1377,2025-01-12 22:32:15,https://www.reddit.com/r/aws/comments/1hzyyvm/could_aws_be_the_solution_for_our_company/,False,False,False,False
1hzslg5,Suppress cdk-nag findings for custom resource singleton lambda globally,2,4,jaykingson,2025-01-12 18:01:46,https://johanneskonings.dev/blog/2025-01-12-aws-cdk-nag-custom-resource-singleton-suppression,False,False,False,False
1hzxmxi,What's the difference between options listed when creating access key for IAM User?,1,1,Dry-Weekend-8279,2025-01-12 21:34:29,https://www.reddit.com/r/aws/comments/1hzxmxi/whats_the_difference_between_options_listed_when/,False,False,False,False
1hzwbat,403 Forbidden on signin.aws.amazon.com/saml,2,2,0zeronegative,2025-01-12 20:38:10,https://www.reddit.com/r/aws/comments/1hzwbat/403_forbidden_on_signinawsamazoncomsaml/,False,False,False,False
1i02yb6,Need advice on simple data pipeline architecture for personal project (Python/AWS),0,8,BlackLands123,2025-01-13 01:43:59,https://www.reddit.com/r/aws/comments/1i02yb6/need_advice_on_simple_data_pipeline_architecture/,False,False,False,False
1hzusft,help me in API Gateway resource policy ,1,2,Some_Employment4931,2025-01-12 19:33:56,https://www.reddit.com/r/aws/comments/1hzusft/help_me_in_api_gateway_resource_policy/,False,False,False,False
1hzr0qi,Securing specific credentials for Static Site,1,1,Apart-Permission-849,2025-01-12 16:55:18,https://www.reddit.com/r/aws/comments/1hzr0qi/securing_specific_credentials_for_static_site/,False,False,False,False
1hzizg0,AWS S3 image signed URI doesnt show in React Native Mobile App (Expo),1,6,abdrhxyii,2025-01-12 09:16:39,https://www.reddit.com/r/aws/comments/1hzizg0/aws_s3_image_signed_uri_doesnt_show_in_react/,False,False,False,False
1hzibhf,want to emit 'business' events from our platform systems - not sure whether SQS or Eventbridge or something else.,1,5,extra_specticles,2025-01-12 08:27:01,https://www.reddit.com/r/aws/comments/1hzibhf/want_to_emit_business_events_from_our_platform/,False,False,False,False
1hzdn86,AWS Cloudfront/S3 bandwidth realtime monitor based on object paths,1,1,FlatwormIcy9970,2025-01-12 03:25:25,https://www.reddit.com/r/aws/comments/1hzdn86/aws_cloudfronts3_bandwidth_realtime_monitor_based/,False,False,False,False
1hzmqt2,Why is my vps very slow ?,0,15,me_localhost,2025-01-12 13:33:07,https://www.reddit.com/r/aws/comments/1hzmqt2/why_is_my_vps_very_slow/,False,False,False,False
1hzr89s,Amazon Phone screen invitation ,0,12,BA_Knight,2025-01-12 17:03:55,https://www.reddit.com/r/aws/comments/1hzr89s/amazon_phone_screen_invitation/,False,False,False,False
